{"auth_outcome":{"onboarding":false,"reason_code":"ok","scheme":"hmac-adr005","status":"pass"},"body_base64":"eyJyb3V0aW5nX2tleSI6InJrLTAxMjM0NTY3ODlhYmNkZWYwMTIzNDU2Nzg5YWJjZGVmIiwiZXZlbnRfYWN0aW9uIjoidHJpZ2dlciIsInBheWxvYWQiOnsic3VtbWFyeSI6IkRCIGxhdGVuY3kgcDk5ID4gMnMiLCJzb3VyY2UiOiJkYi1wcmltYXJ5LTEiLCJzZXZlcml0eSI6ImNyaXRpY2FsIn19","body_size_bytes":168,"headers":{"content-type":"application/json","x-sentinel-signature":"sha256=REDACTED-IN-FIXTURE","x-sentinel-timestamp":"1788398390"},"received_at":"2026-10-05T14:39:55+00:00","request_id":"9f3c2a1e-4b5d-4c6e-8f7a-1a2b3c4d5e6f","route":"/v2/enqueue"}