{"auth_outcome":{"onboarding":true,"reason_code":"no_signature","scheme":"hmac-adr005","status":"bypassed_onboarding"},"body_base64":"eyJzZXJ2aWNlIjoiY2hlY2tvdXQiLCJjaGVjayI6Imh0dHBfNXh4Iiwic2V2ZXJpdHkiOiJlcnJvciJ9","body_size_bytes":60,"headers":{"content-type":"application/json"},"received_at":"2026-10-05T14:40:02+00:00","request_id":"onboarding-sender-migration-0007","route":"/webhook/generic"}